Response,Utterance
فكرة حلوة خلينا نروح,تروح عل مكتبة معي؟
الليلة صعبة شوي لأن رايح على عرس رفيقي,ايمتى منقدر نعزمك عل عشا؟ شو رأيك الليلة؟
عنجد؟ هلقد مبين عليي اني مبسوط؟,مبين في بتمك حكي
ما في شي محدد بحب تابع كل شي,ايا رياضة بتحب اتابع اكتر شي؟
"الحمدلله تمام, شكرا عل سؤال, كيفك انت؟","صباح الخير, كيف كل شي معك؟ "
"الله يعافيك , اكيد ولو!","يعطيك العافية, ممكن تساعدني بتدوير المكنة؟"
ماشي شكرا,"ما تخاف, خليك عم تجرب"
كنت حب العب داما وشطرنج,شو الألعاب لي كنت تحب تلعبا انت وصغير؟
"كنت متوقع يصير هيك, صار بيناتن مشاكل كتير اخر فترة",هيدول لي كانوا علقانين الأسبوع الماضي اطلقوا
الشي لي ما بينبنى على حب واحترام متبادل ما بينجح,شو رأيك بالزواج الي ما بينبنا على حب؟
بحب سفر السياحة بس سفر الشغل ابدا,بتحب تسافر؟
زارع تشكيلة منوعة! شو ما بيخطر على بالك!,شو انواع الخضرة لي زارعن بالجنينة؟
بهل وقت من السنة بكون دف,كيف كان الطقس بالبلد الي جاي منو؟
بشو بقدر ساعدك؟,يا الله! حأتخر عل موعد!
ما في شك! انشاالله بعطلة الربيع الجاي,لازم تصير تزورنا اكتر 
مش عارف خليني شوف,شو هيدا الشي؟
اها! عقبال منشوفك انت المدير,اليوم عينوا مدير جديد بالشركة
ايه بجنن!,الطقس حلو اليوم ايه؟
ايه فاضي بس مش حابب روح,فاضي نهار الأحد لنروح عل ماراثون؟
لا ابدا! ما حبيتو ابدا,شو عجبك الفبلم؟
والله ما في شي بس شويت ضغط من الشغل,شو القصة ليه هلقد تعبان؟
شو عم تحكي! مين خبرك هل حكي,بتعرف انو شرب البيرة بخلي صوتك احلى؟
اكيد تفضل,"عفوا, ممكن تزيح شوي؟"
علينا وعليك,"اسبوع الجاي ببلش شهر رمضان, رمضان كريم!"
ليش لوين بدك تروح فيها؟,"من بعد اذنك, ممكن استعير البسكليت؟"
ابدا! الدنيا فرص والشاطر ما بفوت فرصة هيك,ما بتحسها غريبة انك تستلم مطرح المدير القديم؟
ما بتقدر تخسرني,شو رأيك خسرك بلعبة التنس؟
ايه السعلة صارت اقوى كمان , بعدك عم تسعل؟
معك حق بس هيدي عادة قديمة ما بقدر وقفها,لازم توقف تدخين عم اتضر صحتك كتير
"منيحة, سافرت على استراليا ونيوزلاندا ",كيف كانت الصيفية؟
مافي شي شكرا عل اهتمام,صرلك فترة مش مبسوط شو القصة؟
شفتو حبيبي يعطيك العافية بجنن,ماما ممكن تراجعلي الفرض قبل ما سلمو بكرا؟
ايه اكيد ما عندي مانع منغير جو شوي ,شو رأيك نروح نكزدر عل كورنيش نهار الأحد؟
كل عام وانت بخير!,ميلاد مجيد! 
ما تعتل هم. كل شي حيكون منيح,انا انتهيت. فلست رسميا
اكيد. لحظة لجيبها من الخزانة,ممكن تفرجيني البدلة تعيتك؟
كيف بتسترجي تحكي معي هيك؟,انا تعبت منك! انت مين مفكر حالك ولا؟
ايه. السبت والأحد رحت,مبين عليكي مسمرّة. شو كاينة عل بحر؟
القلب بيضخ الدم يا استاذ,اليوم حنكمل درس  العلوم. شو وظيفة القلب بالجسم؟
ليش؟ هيك عم بخلق فرص اكتر ,هيدي الخطة مش منيحة لشغلك. عم تلعب بالنار
ايه. جدي علمني ياها,بتعرف تلعب شطرنج؟ 
انا كمان! اتبسطت بشوفتك ,يا لطيف لديه صرني مش شايفك! 
ايه لأن بحاجة لواحد اكبر,شو مبين جايب براد جديد؟
ايه! تعلمت كيف هيديك السنة وحبيت كتير,شو بتحب التزلج؟ 
تكرم. بتحب حطلك الحجز ليوم تاني؟,بدي الغي حجز نهار الخميس بليل ازا بتريد
اكيد. بس انتبه يمكن بدو تشريج,ممكن اسعمل اللابتوب تعولك شوي؟
بعرف مطعم بيعمل طبخ لبناني. بدك نجيب؟,تعبت من الأكل الجاهز. اشتقت اكل طبخ لبناني
جبتلها ورد واشتريتلها غسالة.,شو جبت لأمك ع عيد الأم؟ 
ما بعرف ما فكرن بهيدا الموضوع قبل,شو حيصير بالولاد ازا اطلقت انت والمحروسة؟
ايه سافرت مرتين قبل هيك,مسافر قبل بمرة عل يابان؟
بعدني مطرح ما كنت ما غيرت,وين ساكن هلق؟
عمال معروف بدي اشتري هيدول الكتب,كيف بقدر ساعدك استاذ؟ 
بشوف. مين ومين رايح؟,بتحب تروح ناكل اكل صيني نهار الجمعة؟
لا. كنت ضل مشغول بالدرس. انت كنت تشتغل؟,كنت تشتغل ايام الجامعة؟
ابدا. ما تسليت بالمرة,حبيت اللعبة؟
اكيد. بس لازم ترجعن خلال اسبوع,ممكن استعير هل كتابين؟
ليش خير شو القصة؟,عنجد انا ما بعرف كيف ابتليت وتجوزت
بعدا بألف ليرة,اديه حق الجريدة اليوم؟
متضايق من الوضع بالبلد ,شو ليش معصب؟ 
ياالله! كنت كتير حابب روح,كل التذاكر انباعت. مش حنقدر نحضر الحفلة.
لا مش ضروري. البوظة بتكفي وبتوفي,بدك حطلك فواكه حد البوظة؟ 
الأزرق السماوي او الأزرق الفاتح,شو لونك المفضل؟
تكرم عينك. ما بدك خس كرمال السلطة؟,عمال معروف بدي كيلو بندوة و تنين كيلو خيار
ماشي. حاسب عل صندوق و عشر دقائق بكونو جاهزين,من بعد امرك بدي سندويشة كفتة وسندويشة طاووق.
ايه. هبق بعطيك رقم الي بقص عندو,بدي روح قص شعري. بتعرفلك حلاق شاطر؟
ليش؟ انت بهمك هل مجال؟,لازم اخد مواد بإدارة الأعمال قبل ما اتخرج
سبعة وستين راكب.,كم راكب في عل طيارة؟
ضغط كتير. اخد مواد زيادة كرمال اتخرج عل وقت,شو كيف دوامك هيدا الفصل؟ 
ايه ما كانت تدور السيارة معي الصبح,مرحبا. شفتك جاي مشي عل شغل اليوم
بعتذر. علقت بعجقة سير,صرني اكتر من نص ساعة ناطرك. ليش تأخرت؟
تأكد قبل انو في مي سخنة,انا فايت اتحمم
ايه. اعملي معك عمال معروف,تشرب شاي اخضر؟
شكرا! عيونك الحلوين,شو هل الجنينة الحلوة! لون الورد بجنن
معك حق. لازم اعمل رياضة,لازم تصير تهتم بصحتك. ما بصير هيك
لوين بدك تروح؟,بس خلص درس لازم اضهر غير شويت جو
ولو! انت من اعز الناس علينا,شكرا عل الهدية! كلكن ذوق
سلامة راسك. اعطيك حبة دوا؟ ,حاسس راسي كتير عم يوحعني
شكرا! هول ستي  خيطتلي ياهن,طالع هل التياب الحلوين!
تعرفنا عبعض بالجامعة,شو ما بدك تخبرنا كيف تعرفت عل العروس؟
لا بعتذر اليوم مفول. بدك بكرا؟,فينا نعمل الحجز الليلة؟
الحمدلله. هوي شوي تعبان بس ماشي الحال,صرلي خمس سنين مش شايف ابوك. كيف صحتو؟
كتر خير الله الحمدلله عل نعمة الصحة,يخزي العين مش مبين عليك الكبر
يلا جيت جيت,يلا بسرعة بسرعة! حنتأخر
ما في شي محدد. بس اكتر شي بحب الأكل اللبناني,شو اكلتك المفضلة؟
حبيبي ما بتقصر! شكرا,ليك ايا نصيحة بدك ياها انا بالخدمة
خير شو في؟ شو صاير معك؟,انشاالله بحكيك بس ارجع من المستشفى
ايه ما في مشكلة. شي ساعة وبروح,بتقدر تروح تجيب دجاج وكزبرة؟
صح بس يمكن ما معنا وقت.,لازم نشطف البيت قبل ما يجو الضيوف
فكرني عم اتمسخر عليع بس انا ما اتمسخرت,ليش علقت انت ورفيقك؟
يا زلمة خليك قاعدين,يلا صار لازم نروح.
بيسيطة يعطيك العافية. جمعتين وبترتاح,كتير تعبان ومضغوط من الدرس
جيب شي جاهز,محتار شو بدي اعمل غدا
بسيطة. اليوم بليل منقرا الكتاب بيمشي الحال,يا زلمة ما فهمت شي من المحاضرة
بدي كمل دكتوراه,شو حتعمل من بعد ما تتخرج 
بعدني ما بعرف شو ممكن اعمل,شو حتعمل بالصيف؟ 
بيي استاذ رياضيات بالجامعة,شو بيشتغل ابوك؟
يا لطيف! الله يرحموا ويحسن اليه,جدي توفى مبارح
شو هل السؤال الغريب,شو رأيك اهم الذكاء العاطفي او الذكاء الفكري؟
يلا  خمس دقائق وبكون حاهز,لك يلا خلصني صار لازم نروح!
ماشي الحال الحمدلله,شو كيف الدرس؟
اوف يا لطيف شو بتنق,واخيرا خلص الفيلم! ابشع فيلم شايفو بحياتي
بعرف احكي عربي و انكليزي وفرنسي,كم لغة بتعرف تحكي؟
عفوا فكرتك بتعرف,ليش ما قلتلي انك مزوج؟
ايه كتير!  غيرت جو الي زمان مش ضاهر,شو انبسطت بضهرة مبارح؟ 
بعتقد حكمل ماجستير,شو حتكمل ماجستير او حتشتغل من بعد التخرج؟
عشر ليرات بس. حسيتو مش كتير غالي,اديه دفعت حق الكتاب؟
وانا كمان! نفس الشعور!,شو هل الضهرة الحلوة! انبسطت كتير
انشاالله! من وين حتجيب طوب التخرج؟,حفلة التخرج حتكون حلوة كتير! 
ايه بس ناقصو شويت ملح.,مرحبا.  انشاالله الأكل على ذوقك؟
صح وخاصة موسيقى فيروز,مش معقول ما احلىى الموسيقى الرايقة عالصبح!
ليش؟ حضر منيح وماعليك. وانا جاهز للمساعدة,شوي موتر من اجتماع  الجمعة
فاتو  ناموا  بكير,شو ليش مافي حدا؟
ايه طلعت الأول عل دفعة! ,شو مبين عليك محمس!
ماشي تصبح عل خير,لازم فوت نام بكرا عندي شغل بكير
بدي نضف البيت واطبخ ,شو حتعمل اليوم؟
ايه مش عم يجيني نوم,بعدك فايق؟
ايه فكرة حلوة!,ممكن  نعمل غدا لكل الي بشتغلو بالمعمل؟
عطلة بمناسبة عيد المعلم,ليش نهار الخميس عطلة؟
ايه مش غلط. بس وين حتتصيدو؟,تروح تتصيد سمك معنا نهار الجمعة؟ 
حسيت حالي تعبان شوي ما رحت,ليِش بعدك بالبيت؟ مش مفروض تكون بالمدرسة؟
ايه شي بيسم البدن,قريت الجريدة اليوم؟
قهوة اذا ممكن,بتحب تشرب شي بعد الغدا؟ 
لا شكرا شبعت,بدك تاكل شي بعد؟ 
جيب فحم وغراض السلطة,ماما شو بدك جبلك غراض؟ 
ممكن نعمل سمك مشوي؟,شو بتحب تتغدى اليوم؟ 
كان في عجقة سير كتير,شو ليش تأخرت 
اها! ليش اليوم بدك تطبخي  فاصوليا,بدي روح عند اللحام جيب لحمة للفاصوليا 
خلص اشتري وحدة جديدة,خربت الغسالة! هاي تاني مرة بتخرب بظرف شهر
ما عندي وقت,لازم تنضف غرفتك
الحمدالله حظنا حلو.,ما كنت متخيل انو تنجح خطة السفر
ايه بنصحك اكيد. بدك شي كوميديا او شو؟,بتقدر تنصحني بشي مسلسل حلو احضرو؟
اكيد!  ليش لأ,بتحبي نرقص سوا؟
ايه مش غلط. بس اديه بتكلف؟,شو رأيك نستأجر سيارة ونلف فيها  كل المنطقة؟
مين؟ ما تقلي رفيقك المزعج,حزار مين شفت مبارح
كمان! ليه بتضلك مقطوع من المصاري؟,فيك اديّني خمسية الف؟
بشو بدي اجي؟ النقل العام متعب و مش مريح,ليش بتجي بسيارتك عل شغل؟
اليوم واحد آذار,اديه اليوم في بالشهر؟
لا هيدي تاني سنة,هيدي اول سنة لألك هون؟
انا كمان. والله بيستاهلوا  كل  خير,انبسطلن  كتير انشالله بيتهنو
اطبخيها افضل. ما باكل لحمة نيّة ,بتحب تاكل الكفتة نية او بطبخلك ياها؟
كرت شو؟ ايا عزيمة؟,وصلك كرت العزيمة؟ 
ليه؟ خلي املك بألله كبير فترة وبتمرق,فقدت الأمل بكل شي
يلا لحظة لألبس عليي,اليوم الأحد. خلينا نضهر نشم شويت هوا  نضيف.
لا ما تروح يمكن تشتي الدنيا,عم فكر روح امشي بعد الغدا 
انت نقي لي بدك ياه وتكرم عينك,شو حتجبلي هدية على عيد ميلادي؟
والله تعبان كتير من ظروف البلد الصعبة,مبين عليك قلقان. خير صاير معك شي؟ 
ايه اكيد  الدنيا برد ما فيك تضهر من دون جاكيت ,ليك ممكن تعيرني جاكيت من عندك؟
ايه لاحظت!  لازم ناتقي و نسمع سوى,لاحظت انو طلعنا منحب نفس نوع الموسيقى؟
اشترك فيها بصير فيك كل يوم تفوت,ياريت لو بيسمحولي فوت عالمكتبة
لا بعد  ازا  مستعجل انطرني برا ,شو جهزت؟
ايه. صرلو مجوز اختي عشر سنين هلأ عرفت؟,هيدا صهرك؟
سافرت انا والعيلة عباريس,وين قضيت راس السنة؟ 
لك ايه!! يمكن نربح الماتش,واخيرا حطو غول!
لا بعتذر مشغول ما فيني,بدك نتغدى سوى نهار السبت؟ 
لأن كنت عم قطع بصل,ليش عم تبكي؟
يا عمي روق مش مستاهلة هلقد,يا خيي بلش دمي يغلي بدك تحل عني او لا؟ 
ايه اكيد. شو بدك تقدم؟,ليك بتساعدني شوي بموضوع القروض؟ 
بدي سندويش  لبنة مع زيتون,شو بدي لفلك؟ 
شوب. قالوا عل اخبار انز درجة الحرارة حتكون ثلاثين ,كيف حيكون الطقس بكرا؟
لا حبيبتي عندي درس,انا رايحة كزدر تروح معي؟
ليش لازم؟ ليش أنا يعني ما في غيري ؟,لازم تترشح عالأنتخابات 
ايه ما جبت معي شمسية,شو كنت ماشي تحت الشتا؟
دقيت وقلتلن اني مريض,ليش ما رحت عل شغل؟
والله وجعت راس كبيرة,شو كيف الجامعة؟
بتفضل الجامعة الخاصة او الرسمية؟,مش عارف على ايا جامعة بدي قدم
هلأ بجيب حطب مع شويت مازوت,كيف بدك تولع الصوبا؟
اوف ليش شو صاير؟,هيدا اسوء نهار بحياتي عالأكيد
صح وما في خطط لتنحل الأزمة,مستوى التلوث مرتفع وخطير كتير
مش عارف. شو عبالك أنت ؟,شو بتحب نعمل الليلة؟
خراس. عروف حالك مع مين عم تحكي,ليك بتلزم حدوداك احسن ما كسرلك راسك.
ما بعرف بس اكيد مش اكتر من عشرين كيلو,اديه وزن الشنطة اللي معك؟
ايه بجي اكيد. بأيا بستان منا نبلش,تجي تساعدنا بقطف الزيتون؟
اذا قدرت اكيد. شو بدك ؟,ممكن اطلب منك طلب وما تخيبني؟
مش دايما. بحسو جدي كتير,مهضوم استاذ الرياضيات
لا مش جاي عبالي ,تروح عالصيد بكرا؟
شو هيي؟ شو بدك ؟,ممكن تعملي هالخدمة؟
لا شكرا حبيبي ,حأعمل شاي اعمل حسابك؟
لك مش عم اسمعك منيح!,لك ليش مش عم تنقبر ترد؟ 
بخلص عل ساعة خمسة,ايا ساعة بتخلص؟ 
مافي شي كلو عن الأنتخابات,شو في اخبار اليوم؟
ايه مرة وكانت بتقرف,شي مرة مسافر على السفينة؟
ما فينا نعمل شي,شو منا نعمل
حيالا شي لجبران خليل جبران,شو كتابك المفضل؟
متساعدني حل عني بس!,كيف بقدر ساعدك بهل حالة؟ 
ما نقيتن سجلت الموجود,كيف نقيت المواد تعولك؟
ايه كلن عنصريين ,حدا الك شي كرمال لون بشرتك؟
وين الصف تعولك؟,بتقدر تساعدني اوصل عالصف؟ 
تلعب شطرنج,تعا نلعب لعبة
ما بعرف اول مرة بشوفها,مين هيدي لي واقفة حد الشباك؟
بفكر وبردلك خبر,انا بنصحك تشتريها للسيارة مش ممكن تلاقي احسن
عادي حلو ما اشبو شي,شو كيف كان نهارك
ايه بلبل بالفرنسي,بتعرف تحكي فرنسي؟
ماشي الحال. العلاقة رسمية متل ملازم تكون,كيف علاقتك بمدير الشغل تعولك؟
بالمدرسة الرسمية,بأيا مدرسة حاطت ولادك؟ 
ايه كل يوم بنام ساعة اوساعتين,بتقدر تنام بعد الضهر؟
مبلا اكيد يلا الحقوني,شو مابدك تفرجينا عل بيت؟
ليش ما خبرتني قبل؟ شو رايح تعمل,انا مسافر الخميس على دبي. بتوصيني شي؟
والله صرلي فترة مشغول. انت كيفك شو اخبارك؟ ,وين هل غيبة عاش مين شافك!
بتصدق مش جاي عبالي اضهر اليوم,اليوم مثالي لنعمل جولة بالجنينة
كنت عم اتحمم وقت اتصلت,اتصلت فيك مبارح ليش ما رديت؟
مش معروف ايمتىى بس مفروض اخر الشهر,ايمتى حتخلف مرت خيك؟
سافر يشتغل بالسودان,لوين سافر خيك؟
ايه معك حق انا تعبت كتير,صرلنا من الصبح عم ندرس خلينا نرتاح شوي
ليش؟ مش غالي كتير؟,افضل محل للسكن هوي راس بيروت
لا شكرا ما بدي روح. ازا في قريدس جيبي معك,بدي روح عالمسمكة اشتري سمك. تروح معي؟
لا مش اول مرة. انا مشترك هون وهاي بطاقة الأشتراك,اهلا! اول مرة بتجي لعنا؟
اليوم ما اجت بالمرة,ايا ساعة اجت الكهرباء؟ 
بس اسقي الزريعات. ما تعمل شي غير,شو بدي اعملك بالجنينة؟
اختي ليش ؟,مين هيدي لي اجت معك مبارح؟
البطالة. في كتير شباب وصبايا قاعدين بلا شغل,برأيك ايا مشكلة اجتماعية لازم الحكومة تركز عليها؟
عندي كلب. ما بحب البسينات,عندك بسينة او كلب؟
ليش غيرت رأيك؟ مش على اساس نروح عالسينيما,يلا فوت منسهر عندي اليوم
بشعة. كتير بكرهها ,شو كيف كانت المدرسة اليوم؟
ما تتأخر وما تبعد,رايح كزدر شوي بالسيارة
ولا شي. ما في بنفسي شي,شو بدك تتعشى؟
حبيت غير شوي,ليش مش جايب اكل معك من البيت اليوم 
معظم الناس بتحب الفوتبول,ايا اكتر رياضة مشهورة بالبلد؟
ولو هيدا اقل واجب,شكرا على تعبك معي. ما ح انسالك ياها
مش جاييني نوم,ما بدك تنام؟ 
يعني اخدت القرار النهائي. ايمتى مسافر,جاي ودعك بتوصيني شي؟
ايه الهوا كتير حامي,الطقس بشع كتير اليوم 
ايه! ضرب عامود الكهرباء,شفت البرق شو قوي!
هون بالضيعة,وين رحت مشيت؟ 
لا ابدا ما في حدا,كان في عجقة عالطريق؟ 
من المستقبل المجهول,انت من شو خيفان؟ 
ايه الي عندك صارت كتير قديمة,عم فكر اشتري سيارة جديدة
لا بعد عندي كم ورقة لازم اقراهن,خلصت شغل؟
درس كل النهار,شو عندك بكرا؟
اكيد ما تعتل هم,سوق على مهلك
والله خسرنا و بقوة كمان,شو ربحتو او خسرتو الماتش مبارح؟
"الحمدالله، احسن شوي بس بعدا تعبانة",كيف صارت امك؟ سمعت انو مريضة
اووه أخيرا صار فينا نقلك مبروك,اليوم عرفت انو انقبلت بالشغل اللي كنت مقدم علي
المفروض العاصفة يومين و بتخلص,"والله كتير برد، ايمتى بدو يصحا الطقس بقا"
"حبيبي اجلا شوي، نحنا آخر الشهر شو نسيت","خلينا نروح عالسينما بكرا، صرلنا زمان"
ايه حرام صرلو زمان ما شافن,شفت كيف صار يلعب مع رفقاتو
صرلي شي ٣ سنين مبلش شغل,عم تدرس بالجامعة او عم تشتغل
"نشاالله حبيبتي، بيكبر و بيطلع احسن مني",ياريت ابني بيكبر و بيصير متلك
"عم فكر روح زور الماما، زمان ما شفتا",شو عندك مشاريع اليوم
ماشي الحال و انتا,كيفك حبيبي شو اخبارك 
مرسي حبيبتي و انا كنت مبسوطة,"كانت طلتك اليوم بتجنن، الكل انبسط"
"لسا بكير، بعدا السهر باولا","تأخر الوقت شوي، يلا خلينا نفل"
"لا زمان تركنا، ما زبط الموضوع",بعدك عم تشوف نفس البنت
"والله كتير مشغول، بتعرف الدني و مشاغلا","كيفو الحلو، زمان ما شفناك"
"الواحد ما بيعرف ايمتا بيموت، ما تخلي شي بنفسك","في كتير اشيا عبالي اعملا، بس عم ضل مشغول"
"لا والله لسا، عم بقراها على مهلي","شو عم تقرا هالايام، خلصت القصة اللي عطيتك هيي"
"تلفون الشغل، مهم ايه؟", هيدا تلفونك او تلفون الشغل 
"حلو، شو مخطط تعمل، عشو ناوي",بكرا عيد ميلادي و بدي اعمل حفلة
"عنجد انو لقيتا كتير صعبة، ما كانت تزبط معي","ما تعتل هم، المرة الجاية بتزبط معك"
"اوف لا والله، كيف صارت","هلق وصلت عالبيت، عرفت انو بيك كاسر اجرو؟"
"بركي اول الشهر الجاي ، بتعرف وضع البلد",ايمتى ناوي تدفع الفواتير المكسورة عليك
"ماشي الحال، رواق","مرحبا، كيفنا اليوم؟ "
بدي اشتري غسالة بس تكون مستعملة,"اهلا و سهلا، كيف بقدر ساعدك"
اوف ليس هيا عاملة بحالك,عرس رفيقتي بعد كم يوم و لسا ما جبت فستان
"خلص اخر مرة بجيب غراض منو، شي بجرص",معش تعيديها و تشتري من نفس المحل 
"كل شوي بدك تقلي هيك، شو بعمل بطير يعني","استعجلك شوي، اذا هيك بتضل منتاخر"
ايه شافو والله ما تخاف,انتبه تدعس عالزلمي الي ماشي بنص الطريق
ما بعرف صرلي من مبارح مكركب ,"مبين عليك تعبان شوي، شو صاير معك شي"
ايمتى ما بناسبك انا كل يوم فاضي ما عندي شي,ايمت بدك تمرق فرجيك عالصوبيا اللي جبتا جديد
ايوا سماالله عليها اكيد بدا تطلع حلوة لاما," بنت رفيقتي طالعة كتير حلوة، عيونا خضر و شعرا اسود"
"تيتا ايه، بس جدي عطاك عمرو زمان",ستك و جدك بعدن عايشين
ايه والله العمر غفلة,"هالايام كيف عم تركض ركض، مبارح كنا صغار و عم نلعب "
