Response,Utterance
"شو هالحظ اللي عليك، لو عارف كنت ذكرتك",نسيت انو تسجيل المواد اليوم و سكرو الصفوف اللي بدي آخدا
لا ولا يهمك واجبنا,"شكرا كتير عالمساعدة اليوم، قدرنا نخلص بكير بفضلك"
بعد حدا عم يسال هيك سؤال,كيفنا اليوم ؟
الله يوفقك وتوصل بالسلامة,اجا قبول السفر واسبوع الجاي انشالله طيارتي
لكان لازم صير نام بكير,شكلا المدارس رح ترجع تفتح
قلي لازم امشي كل يوم ساعة عل الاقل,شو صار معك عند الحكيم شو قلك كرمال اجرك
لا الحمدالله مهم نضل عم نشتغل,كيف الشغل انشالله مش تعبان
والله ما عم لحّق ع شي كلو ضغط بضغط!!,شو عم تعمل هالايام؟
و أخيرا رح تخلص هالأزمة قريبا,عم يقولوا نجح اللقاح
لا مش كورونا اكيد حساسية,ما عم شم و دوق لي قولك؟
"يلا بسيطة، بتقدّم عجامعة غيرها",ما قبلوني بالجامعة
"لي خير شو صاير، بركي لازم تروح عند الدكتور","كتير عم بتوتر هالايام، ما بعرف شو صايرلي"
"مزبوط الا حسناتا، بس الجبل احلى",الحمدالله انو عايشين بالمدينة
"اكيد بعرف، بس ما قادر وقفو",بتعرف انو التدخين بضر بصحتك
كتير بايخ و ما بينحضر,"مرحبا، شو كيف لقيت الفيلم"
يالله عال المهم يكونو انبسطو الولاد,اليوم شفنا فيل كبير بالسيرك
اكيد و اذا مش فاضي بفضي حالي كرمالك,فاضي شوي نشرب قهوة سوا
"مش اكيد صراحة، بس مفروض ساعتين","الفيلم شوي و ببلش، كم ساعة هوي على علمك"
بيروت هي العاصمة السياسية للجمهورية اللبنانية وأكبر مدنها,شو عاصمة لبنان
"الدولار صلر بالسما، قد ما بدك",ادي الدولار اليوم
"والله عاملين كبة بالصينية، اتفضل",شو طابخين اليوم؟
اكيد كل يوم عالاونلاين,عم تدرس بهل ايام ؟
إنو أكيد منا نخلص بقى من هالقصة والله تعبنا.,"شو رأيك بموضوع لقاح كورونا، ح تاخدو؟"
"ايه خيي، من وين جبتو",ليوم جبت كيلو عدس مدعوم
يلا صرت واصل,وين صرت؟
اشربي مي اكتر وخدي فيتامينات,حاسة حالي عم ضل نعسانة وكسلانة
اوووووه بالسما,قدي الدولار اليوم
ييي ألف مبروك تتهنو,ما عم صدق عرسي بعد شهر!
يلا بدك نضهر بكرا؟,عبالي آكل سوشي
الحمدالله ماشي الحال,كيفك و كيف كل شي؟
"صار طالع، شي ١٠ دقايق بس",قديش بعد في للغدا
لا الحمدالله مهم نضل عم نشتغل,كيف الشغل انشالله مش تعبان
"بعد في أسبوع، شفلك شي تعملو بهالوقت",ايمتى بيخلص هالحجر؟
سمستر واحد و بدي كفي ماستر,كم سمستر ل تتخرج بعد
اخصائية تغذية,شو دارسة اختصاص
طبعًا,عم تراكم عليك دروس
بهل بيت,شو تخطيطاتك لبكرة
"خدلك حبة بانادول، اذا ما في فوت نام شوي",عم يوجعني راسي كتير. شو فيني ساوي
"حسب آخر تعميم، ببلش الساعة ٨",دخلك اي ساعة ببلش منع التجول
ماشي الحال,كيف حال الدرس ؟
لا عندي دراسة,جاي بكرا ؟
اي اكيد ليش تما صدق ؟,بتصدق الكورونا ؟
بحب اسبح اكثر شي,شو اكثر رياضة بتحبها ؟
ايه بعد شي ساعة منلتقي,فاضي شوية نشرب قهوة
لأني لبناني برو,ليه هلقد تعبان يا زلمة
اي أكيد و حتحبا كتير,بتقدر تعلمني كيف أكتب برامج للأندرويد ؟
ان شاء الله مع الطعوم بتنحل الأزمة و بيخلص كورونا قريبا,كتير جاي على بالي سافر بس أيمتى بدو يخلص هالكورونا
"فيك تاكل شي خفيف، شو رأيك بالبسكوت مع موز. ","كتير جوعانة، اقترح شي اكله "
الله اعلم بس شكلنا مطولين,ايمتن بدنا نخلص من كورونا ؟
"بالتوفيق، الحياة هونيك الها غير نكهة",قررت سافر على إيطاليا لكفي تعليمي
منيح كيفك أنت ؟,كيفك؟
مبرووك حبيبي كتير انبسطلك,اليوم عرفت انه انقبلت بالشغل ل قدمت عليه
عادي بكل مسابقة هيك بصير,مبارح كان ماشي الروبوت وفجاه اتعطل
مكتبتنا بتبقى فاتحة بالليل,"مرحبا، ايمتا بتسكر المكتبة"
"وانا عجبتني، صرلي زمان ما حضرت شي حلو","المسرحية كتير حلوة، حتى انو بكيت بالاخر"
بلا هالافكار هلق انا ما حسيت بشي,مبارح حسيت انو في حدا عم يلحقنا
والله كنت مسافر اليوم جيت,يا هلا حبيبي زمان ما شفناك
"انا مش اختصاصي تصليح غسالات، بس رح اعطيك رقم حدا شاطر",مرحبا غسالتي خربت و ضروري تتصلح اليوم
"ياريت كل أيامنا تكون هيك، بس يالله هيدي الدني",كانت العطلة بتجنن ما معقول شو نبسطنا
شو نسيت انو ما بعرف كيف,شو ما بدك تسبح
"بعتذر حقك عليي، بس هيك حسيت ",معقول تفكر حتى انو انا كون سارقة تلفونك
ما تخافي كلو بيصسر سهل مع الوقت,هيدا اول يوم الي بالشغل و كتير متلبكة
صرلي ساعة بقلب ما لقيت شي بينحضر,في شي حلو عالتلفزيون
"يسلمو، خجلتوني بكرمكن","كول قد ما بدك، ما تستحي"
خلص عمرو حبيبي ,كتير شفقانة عالكلب اللي مات
اكيد ما عندي شي أصلا اهم منك,"اخدت موعد عند الدكتور هالسبت، تجي معي"
هههه كانك رح تلاقي شغل,عم بدرس هندسة
اوووف كل يوم مجدرة!,عاملين مجدرة اليوم
والله الحمدالله عايشين,اوووه شو وين هالغيبة؟
هيك لان ما بوثق فيك,ليش ما خبرتيني من الاول ؟
"ان شاء الله ؟ شو ان شاء الله، يعني مش رح شوفك.",ان شاء الله الاسبوع الجاي بشوفك.
"بعتقد معي پانادول، خدلك حبة بتنفع",راسي واجعني كتير اليوم!
والله تقريبن صرت اعرف احكي تركي,شو عامل عا هل حجر ؟
يلا بتخدلا يومين معك,بلشت رواية جديدة اليوم
دروس كتير,كيف فيني انجح ؟
شكلو أنا حإخلص وهيي لا,أيمتا يمكن تخلص جائحة كورونا؟
تخطى سعر صرف الدولار عتبة ال١١ الف ليرة لبنانية,شو ابرز حدث صار اليوم
خليك بالبيت كرمال كورونا,لوين بدي اضهر اليوم
معي حبتين بنادول بدك؟,آخ راسي عم يوجعني
يييي الله يعينك!,اليوم شفت حبيبة قلبك
طبخي ايا شي بس مش مجدرة,ما عارفة شو اطبخ اليوم
امشي نروح على الجيم و ناكل صحي,ما عارفة كيف نزل وزني كتير متضايقة
والله انقطع الإنترنت و ما معي ٣جي,شو صار معكي مبارح ما رجعتي اتصلتي؟
يلا ما بقيلو الا شهرين,يا الله اشتقت للصيف
بطلبلك ديليفري؟,ما بحب المجدرة
انا بعملك اطيب دونتس!,عبالي دونتس!
انا هون حدك و اصلا بهل وضع كلنا هيك,حاسة حالي كتير مكتئبة
ييي منيح ما كنت معك ما كنت خلصت من الضحك,اليوم كنت وقعت عالدرج
عنجد! معناها بعقد مش معقول,سمعي هل غنية كتير حلوة!
يلا شو ناطرة قوليلي اسمو بسرعة!,جبتلك اسم مسلسل جديد لازم تحضري!
والله غاطسة بالدرس,لك وينك ما عم نشوفك؟
كان مطفي,ليش ما رديتي على تلفونك اليوم الصبح؟
الله يخلصنا من هل كورونا بقا و انا كمان عبالي,شو عبالي سافر!
شو مجنونة انتي؟ اشبك شي!,كتير عبالي اعمل سكاي دايفينغ!
امشي نروح اسبوع الجاي انا فاضية,صرلي زمان ما سبحت
و انا بالأكتر حبيبي,لك مش معقول شو اشتقتلك
لا!! منير ما غيرو؟,حزري مين حكاني اليوم!
احسن شي جيبي قجة هبكي بتطصيري بتصمدي,ما عم اعرف صمّد مصاري
طلبنا مناقيش جريش,شو فطرتوا
كالعادة محجورين بالبيت روح انضب,شو عاملين اليوم بالسهرة
ايه يا برو حالتي حالي كتير الو عوارض,طمني يا مان عرفت انه اخدت الطعم
و مين سمعك كلنا بالهوا سوا ولادي جننوني,والله يا اختي عم عاني مع ولادي بالتدريس
لا قبل شوي تغيديت.. شو بدنا ناكل !,جوعاني ؟
انسى مستحيل متل وطاويط الليل,لك يا زلمي هول ما بنامو
ايه و شو المطلوب! سكرنا المطعم لليوم لبكرا و عليك خير,مامااا انا جوعاني
يعني بعد كم يوم ؟ ايمتى ؟ اي ساعه ؟ شو بدي البس؟ شو بدنا نجيبلو هديه,اسبوع الجايه عيد ميلاد علي بدنا نروح انشاءالله
بكرا بس قولك شو رح يسالوني,ايمتى عندك مقابله الشغل
شايف بعدنا بالشتى و هيك الله يجيرنا,شو هل الشوب ولووو
"لا ما بدي، كتير بخاف من المرتفعات",شو رايك نجرب التلفريك هالاسبوع
والله ما عندي فكرة ما معي ساعة,حدا بيعرف قدي بعد في وقت ليبلش المسلسل
"ياعيني، ، كيف لقيت المتحف، عذوقك؟",مبارح زرت متحف الشمع لأول مرة بحياتي
"اكيد، شو الاسم الكريم","مرحبا، ممكن نتعرف"
الصيد بدو صبر و طولة بال,"ليش هلقد بتحب الصيد، والله انا بضيق خلقي"
والله التهيت بمحل التياب و راح عن بالي الوقت,"فكرت حالي ضيعتك، وين ختفيتي فجاة"
"يا هلا، اسه والله طقس حلو","صباح الخير، شو هالنهار الحلو"
لو سمحت بدنا نحجز طاولة ل ٢٠ شخص اليوم,"اهلا، كيف فيي ساعدكن"
"صح، و التغيير مش سهل",والله حاسة كل شي عم يتغير والدني مشقلبة
"كتير، توفقت بشغل حلو و بريح الراس",ما قلتيلي اذا بتحبي شغلك 
"يا هلا، لا ما بعتقد","مرحبا، كان تقابلنا من قبل"
ما بدي و أصلا انا مش معصبة,ممكن تريحي اعصابك شوي و بلا خناق
"انا مش بالمود، و ما قلي خلق",ايمتى ناوي تنضف غرفتك
اوف خير شو صاير شو اشبا ,اليوم اخدو اختي عالمستشفى
"في القلعة البرية و البحرية، هول احلى شي",شو في مناطق حلوق اقدر زورا بالمنطقة
"مرحبا جار، ايه و نحنا نبسطنا انو انت جارنا","مرحبا، انا جاركن الجديد، تشرفت بوجودكن بالحي"
عادتن بجرب هدي حالي و بسال حالي أي معصب,شو بتعمل لما تكون معصب
"لا ولو، نوعدنا فيك",انا بعتذر بس ما قادر اجي
طيب خلينا نقوم نقعد بالشمس,بردانة كتير لدرجة انو عم برجف
"مين بيهتم، المهم تكون حلوة",كتير غبية هالانسانة
"كيف يعني، شو هالآحاسيس هلق",لما نكون سوا بحس انو الوقت ما عم يمشي
حبيبتي وين بدن يساعو هول,بعرسي بدي اعزم كا اهل الضيعة
يالله رح دقلو شوف وينو,"أخيرا وصلتي، و بعد في التاني ليش هلقد ماخر"
"ما بعرف، شكلا مضايقة و عم تفش خلقا فينا",ليش المعلمة هيك صارت تعيط بنص الصف
"المفروض، فيها كذا معلم سياحي لان",المنطقة اللي ساكن فيها تعتبر اثرية
"الحق على خيي الزغير، بدي كسرو",ليش هيك وجك كلو شحابير
ايه و صار عندي رفقا جدد,"كبف المدرسة الجديدة، مرتاح"
"عيلتنا كتير كبيرة، في شي ١٥",ك ولد انتو بالعيلة
سقطت بامتحان السواقة و كتير مضايق,"شو بيك، مبين زعلان خير في شي"
بحس حتكون خطرة الشغلة بلاها,"يالله خلينا نروح عالمغارة، ليش خيفان"
مبلا اكيد مبارح اشتريتا و اليوم تفريغا,اشتريت السيارة عروقك او كيف
بدي استعير كتاب كرمال ادرس منو للامتحانات," المكتبة شوي و بتسكر، كيف فيي ساعدك"
لا خير في شي,سمعت الاخبار
"العما شو هالايام اللي وصلنالا، كبف نسرق؟","في خبرية مش حلوة، انسرق بيت رفيقنا اليوم"
ايه لحظة هلق بجيب ورقة و قلم,لازم نتفق عاسماء الناس اللي بدنا نعزما
اه ايه يالله هلق بفيقو تيحكيك,"مرحبا، ممكن تخبري خيك انو انا اتصلت و ناطرو"
بكرا الفجر طيارتي,ايمتا مسافر من غير الشر
عنجد كتير انبسطنا,كانت الحفلة روعة
ثواني بخلص اللي بايدي و بشوفا,هلق وصلتك رسالة فيك تشوفا لو سمحت
حيالله محل غير هون,لوين بدك تسافر و مع مين
هوي الصبح كانت مشمسة ما بعرف شو صار,مبارح نسيت شمسيتي و شتت عليي
طنجرة و لقت غطاها,هول التنين بروحو عالمطاعم سوا و دايمان مع بعض
كتير متعب بس منقول الحمدالله,شو كيف الشغل الجديد
"احلى شي السفر، ،اكتر شي بحب تركيا",بتحب السفر كتير او بيتوتي
"اوف سلامتك، طمني بس تصح",ما رح اقدر اجي اليوم معي اسهال
ماشي الحال أوضاع ما منيحة بس منقول الحمدالله,"كيفك شو الاخبار، الكل بخير"
الأسبوع الجاي عندي شغل بركي اللي بعدو,شو رايك نمشرعا عالبحر الأسبوع الاجاي
اليوم كان عيد ميلادي و ما حدا تذكر,"شو بيك كانو مش رايقة معك، صاير شي"
عطيني اخر فرصة و بوعدك اتغير,ايمتى حتوقف شرب؟ انا معش طايقة هيدا الوضع
طول بالك بعدو السمستر باوله,"وأخيرا خلص الصف، زهقت حياتي يا زلمي"
مرسي ينعاد عليكن بالصحة و العافية,كل عام و انتو بخير 
بحب انزل عالقهوة و اشرب ارجيلة,ايه و شو بتحب تساوي باوقات فراغك
خيي الزغير هوي و عم يلعب,مين كسر القزاز
هوي انا و يادوب شايف,فيك تقرالي شو مكتوب بليز
لا والله الوضع موتر كتير,كيف كان الاجتماع؟ رواٍق؟
شو رايك نقغد وراورا في محلات,وين بقعد كتير في عجقة
ايه جاهزين يالله,شو جاهزين
ما بحبو كتير,شو رايك باللون هيدا
كيف بدي هدي اصابي!,لي متوتر؟ هدي اعصابك
نص ساعة و بيخلص روق,صرلك ساعة ما كان يخلص الفيلم
اوف حدا بينسى هيك شي,نسيت جيب معي اللابتوب اليوم
ايه كاتبين اشيا مهمة,شو عم تقرا بالمجلة مبين
شو بدنا نعملا بس توصل,عم بقولو الأسبوع الجاي جاي الماما من السفر
ولو نحنا بالخدمة,مرسي كتير عالمساعدة
زهقت عيشتي,كيف كانت الحفلة مبارح
لي في شي ما فاجاني بالجامعة,شو اكتر شي فاجآك بالجامعة
زرت ستي,وين رحت مبارح
اوكي شو بدكن,بدنا غراض للبيت
وانا عبالي قريدس ,عبالي معكرونة بالبشاميل
"انا من لبنان، بس عايش باميركا",من وين انتا؟
عم بحضر تلفزيون,شو عم تعمل
اكيد كيف بقدر ساعدك,بدي قدم على منحة فيك تساعدني
نحنا ما حسينا لان شغلنا الدفاية,مبارح كان كتير برد 
حلو ما اشبو ,شو رايك بالمسلسل الجديد
ريح جسمك و خود بانادول,حاسس حالي بدي امرض
استفرغت مرتين الصبح,وجك مصفر كان شايف شبح
"ايه، عندي شي ٢ قريبين مني كتير",عندك رفقا باميركا
شكلني مهموم كتير ايه,مبين عليك مريض كتير
لا ما بعتقد,كان شايفتك من قبل
ربحت اللوتو اليوم,شكلك مبسوطة كتير شو صاير
خلص الأسبوع الجايي,عم نحكي كتير عالتلفون بس لسا ما شفتك
فتش على شغل,شو رح تعمل بس ترجع من اميركا
بدي كفي دكتورا,شو مشاريعك بعد التخرج
منغدى سوا احلى شي,شو بدك نعمل اليوم
لازم كرمال صحتك,بدي بلش دايت نصحانة
انشالله نبسطو؟,اليوم رحت عالملاهي مع رفقاتي
الحمدالله كبرانين بسلمو عليكي,كيفن الولاد صرلي زمان ما شفتن
يالله بعدلو شهرين و بيخلص,ناطر مناطرة ليخلص السمستر
لا ما في أفلام حلوة,شو رايك نروح عالسينما
طفران و ما معي الف بجيبتي,فيك تديني مصاري لاخر الشهر
يا هلا و انا اشتقتلك,اهلا و سهلا اشتقنالك
ايه شمس و برود,الطقس كتير حلو
اكيد اهلا و سهلا,"مسا الخير، فيي اقعد حدكن"
ما بعرف ما قلنا الدكتور لسا,شو طلع جواب اخر سؤال
بعتذر هلق بوطي,صوت الراديو كتير عالي
بيشتغل بمطعم,شو بيعمل رفيقك بالحياة
في واحد آخر الشارع و كتير آدمي,بتعرفلك شي ميكانيسيان شاطر
تمام والله كل شي ممتاز,كيفك و كيف ايامك
لخلص الجامعة بالاول و كلو منيح,ايمتى بدنا نفرح فيكي و نشوفك عروس
ما قلي خلق و تعبان,ليش ما بتنضف اوضتك
حلينا نضهر لكان نغيرلك جو,اليوم كتير تعبان ومهموم
ايوا الف مبروك,خيي انضم للجيش مبارح
كل شي هالايام ما عم يكون سهل,الجامعة صايرة كتير صعبة و مزعجة
صح شوب و قرف,بكره هالطقس
اليوم الخميس,اليوم شو
تعبانبن شوي و يمكن ما يقدرو يجو بكرا,كيف التيتا و جدو
تروح و ترجع بالسلامة,انا مسافر الأسبوع الجاي
كتاب جديد هدية اجاني,شو عم تقرا 
يالله شوي و بجي,خلصت الترويقة
اووه بس انا ما بحبا,عاملين معكرونة بلحمة عالغدا
ايه بس الجامعة بعد احلا و احلا,المدرسة احلا فترة بحياة الولد
بدي اتعشا عند رودستر,شو مشاريعك بالليل
شو سميتوها؟,اشتريتنا بسية جديدة اليوم
كآن كتير طول و زهقنا,بعد ٦ أسابيع بيخلص السمستر
بحس الفريق الآحمر,مين اولك بيربح اليوم
بسلمو عليك الكل بخير,كيفك حبيبي و كيف الولاد
يالله نص ساعة و بكون عندك,بدي احكيك ضروري
من وين بدنا نجيب قهوة هلق,المكنة منزوعة
متت والله لوصلت لهيدي المرحلة,مبروك ربحت الماراتون
اوكي حبيبي ,بدي الطابة الزرقا
تمام انتا كيفك,صباحو كيف الحلوين
ايه و العشا طيب,كتير انبسطت بالقعدة
اوه منيح زكرتني,اخدت المفاتيح
ايه و انا هيك,ما بحب الأفلام الكوميديا
ايه خصوصي أفلام السيارات,بتحب الاكشن 
ايه سهران عالشغل,مبين تعبان
يالله هلق بمرقلك ياه,فيك تعطيني صحن اللبنة
من السوق,من وين جايب كنزتك
الأسبوع الجاي كلو بيفتح,فتحو المطاعم او لسا
بكير والله,مضطرة انو فل هلق
ايه مش مرتاحين هون,فكرتو تنقلو بيتكن
فينا ناكل برا,شو العشا اليوم
شايف وضع البلد,لسا ما جبت اخبار حلوة
ايه و ازا بالجبل احلا و احلا,بتفضل البيت الزغير ؟
بدي امرق عالماما ارجع كفي عبيروت,كيف طريقك الليوم ؟
لازم ريح جسمي,شو قلك الدكتور
رايح عالاسوأ,كيف وضع البلد ؟
هلقد جوعان,بدي اطلب اكل
وهني بحبوها اكتر,هالمغلمة كتير بتحب تلاميزا
صح الوعي ما بينقاس بالاعمار,العمر مش دليل عالوعي
يسلمو حبيباتي,ماما جبنالك ورد
دخل رواقك,بحي الامحل النضيف و الرايق
بسلم عليك,كيفو الحلو
لو جابو اسهل شو كان صرلو,الامتحان كان كتير صعب
مش كتير,عجبتك الحفلة
ما حبيتو كتير,شو رايك في ؟
مبارح كنت و ما في شي حلو,اليوم ضاهرة عالسوق
صح الغلا ما طبيعي,الناس جانة على هالاسعار الجديدة
وين بتحب نتروق,ممكن نروح نتروق سوا بكرا ؟
تعب كتير ,كيف الشغل ؟
ايه حقك,راسي مش عم يتحمل توتر
طب فوت نام,نعسان كتير
ايوا مش لتخطبي بالاول,انا بدي اعزمك على عرسي
ما تعتل هم,كتير متوتر من امتحان السواقة
ما قدرت و ما في وقت,ليش لسا ما غسلت السيارة ؟
بحب الأزرق و الأحمر,شو اكتر لون بتحبو ؟
موفق حبيبي,عندي امتحان بكرا
ايه شو عم مثل,عنجد انو مريض كتير
ايه ماشي الحال ,كيف الصحة كلو رواق
نازل على الدكانة جيب غرضين و جايي,لوين رايح ؟
ليش شو بدك ؟,يعطيك العافية شو اسم حضرتك ؟
الدرس! عم اشتغل على مشروع التخرج,شو مسهرك لهلق؟ 
الحمدلله. متعب شوي بس تمام ,كيف الصيام معك؟ 
ما بعرف. ليش عم تسأل ؟,ايا ساعة حتفيق بكرا؟
عندي تدريب صيفي,شو حتعمل بس يخلص هالفصل؟
حبيبي عقبال عندك,مبروك التخرج يا باش مهندس! 
ايه عالحجر,مبين نصحان!
حنتجمع كلنا اول شهر اربعة. بتحب تجي؟,فيك تخبرني اكثر عن حفلة الربيع؟
لك برافو عفاك!,قررت وقف تدخين 
لا ما عرفت. مين؟,عرفت مين حيتجوز؟ 
ايه ما في شي مستاهل,ما تخلي ببالك شي وما تعصب
وانت بخير حبيبي,حتصير  نص ليل! كل عام وانت بخير!
شوربة وفتوش ومنسف,شو حتعمل اكل عالأفطار بكرا؟
منقوشة جبنة وسجق,شو تسحرت؟ 
شيل التلفون من ايدك وركز,يا زلمة كتير عم ضيع وقت
محدا محدا,شو مين شاغلك بالك؟
حصلي الفجر ونام ,ايا ساعة حتنام؟
ايه هياني قايم ,ما تنسى تفرشي سنانك قبل ما تنام 
لا بقدر احملن  لحالي شكرا,انتبه كتير تقال. احملن معك؟
لا بعدني تلميذ,انت بتشتغل شي؟
كتير شوب البس عليك الكنزة,طفي المكيف تلج قلبي!
